74459878.txt,"Account of the behaviour and execution of Andrew Stewart and Edward Kelly, who were both executed at Glasgow, on Wednesday morning, in the presence of an immense multitude, for the daring crime of street robbery - L.C.Fol.73(92)"
74459879.txt,"Account of the execution of Charles M'Ewan at Edinburgh on ... 7th April, for the murder of Margaret Money, on the Firmonth Hills, in Aberdeenshire, with his behaviour in jail, and at execution - F.3.a.14(23)"
74459880.txt,"Account of Christian Sinclair, executed at Edinburgh on Wednesday last, for murder, with her behaviour at the place of execution - Ry.III.a.2(004)"
74459882.txt,"Particular account of the execution of Hannah Halley, at Derby, on ... March 26, 1822, for the inhuman murder of her ... infant - L.C.Fol.74(70)"
74459883.txt,"Full and particular account of the execution of James Brown and John Craig : who suffered the last-sentence of the law in front of the new jail in Paisley for breaking into the house of Mr. Robertson at Foxbar and stealing a quantity of property and ill u - APS.4.200.03"
74459885.txt,"Genuine and latest account of the execution of John Campbell who suffered at Stirling on ... 14th of May 1824 shewing the lamentable manner in which he cried aloud for mercy, etc. - F.3.a.14(25)"
74459886.txt,"Account of the behaviour, confession and execution of John Howison, who was executed at Edinburgh ... the 21st January, 1832, for the ... murder of an old woman ... at Cramond - F.3.a.13(20)"
74460019.txt,"Voice from the dungeon - L.C.Fol.74(211)"
74460022.txt,"Warning to the wicked, or, Margaret Dickson's welcome to the gibbet - RB.l.106(96)"
74460194.txt,"Confession and execution of Hugh Macleod, who was executed at Inverness, on the 24th of October, for the ... murder of Murdo Grant - F.3.a.13(68)"
74460195.txt,"Execution of Allan Mair, an old man of 80 for the murder of Mary Fletcher, aged 85, at Candie End, or Curshot, parish of Muiravonside, who suffered at Stirling, this morning, Oct. 4, 1843, together with his behaviour in the condemned cell - L.C.Fol.73(122)"
74460198.txt,"Account of the execution of two servant girls, Bridget Butterly and Bridget Ennis, who suffered at Kilmainham Jail on Friday the 4th May, 1821, and their bodies given to Surgeon's Hall, for the dissection, for the murder of Miss Thompson, a young lady, in - L.C.Fol.73(20)"
74460202.txt,"Account of the execution of Dennis Doolan and Patrick Redding for the murder of John Green - L.C.Fol.74(359)"
74460203.txt,"Execution of Elizabeth McNiel or Banks, who was executed ... for the murder of her husband, Peter Banks - F.3.a.13(124)"
74460204.txt,"Account of the execution of Elizabeth Nicklson, or Shafto, or Jeffrey, who  was executed in front of the jail, this morning, for a double murder - L.C.Fol.73(114)"
74460205.txt,"Account of the execution of Francis Cain & George Laidlaw, for two different crimes, and who suffered at Glasgow, on Wednesday the 29th October, 1823, with their behaviour since their condemnation and at the scaffold - L.C.Fol.73(65)"
74460209.txt,"Account of the execution of these two unfortunate men James Anderson and David Glenn at Ayr, on Friday the 12th Dec., etc. - Ry.III.a.2(050)"
74460210.txt,"Account of the behaviour in confinement and on the Scaffold, of James Glen, who suffered at Glasgow on Wednesday the 12th of December, 1827, for the terrible, cruel, and barbarous Murder of his own infant child . . .  with an account of his sorrowful part - L.C.Fol.73(098)"
74460211.txt,"Account of the execution and behaviour on the scaffold, of James Stevenson, for highway robbery, who suffered at Glasgow, on Wednesday morning, the 1st of June, 1825 - L.C.Fol.73(81)"
74460212.txt,"Full and particular account of the execution of James Wemyss ... who was hanged ... on ... the 16th day of April, 1840, for the ... murder of his ... wife [Sarah Wemyss] on the 27th of January last - L.C.Fol.74(199)"
74460213.txt,"Account of the execution of James Wilson and John M'Donald, at Glasgow, on ... 4th day of June, 1823; with their behaviour in jail, and on the scaffold - Ry.III.a.2(040)"
74460216.txt,"Correct account of the execution of John Kerr, who suffered at Greenock, on Wednesday the 6th of June, 1827, for the cruel and barbarous murder of his own wife, with an account of his behaviour since his condemnation and on the scaffold, and his affecting - L.C.Fol.73(96)"
74460218.txt,"Account of the execution of John Stuart and Catherine Wright his wife, for the Murder of Robert Lamont, by poison, on board of the Toward Castle Steam Boat - Ry.III.a.2(089)"
74460219.txt,"Account of the execution of John Thomson and David Dobie, for the assault, murder and robbery of Margaret Paterson - F.3.a.13(11)"
74460220.txt,"Full and particular account of the execution of John Wilson and Duncan Fraser, who were executed at the head of Libberton Wynd, Edinburgh ... 28th January, 1824, for housebreaking and theft - F.3.a.14(17)"
74460221.txt,"Full and particular account of the execution of John Wilson and Duncan Fraser, who were executed at the head of Libberton Wynd, Edinburgh ... 28th January, 1824, for housebreaking and theft; with a particular account of their behaviour since their condemn - F.3.a.14(16)"
74460224.txt,"Full, true, and particular account of the execution of James Bell ... for the murder of Serjeant-Major Moorhead; together with his confession, his behaviour in the jail and on the scaffold, and a short sketch of his life ... July 13, 1835 - L.C.Fol.74(171)"
74460225.txt,"Account of the execution of Robert Emond, who was executed ... March 17, 1830 ... for the murder of Mrs. Franks and her daughter at Haddington, in October last - F.3.a.13(84)"
74460227.txt,"Full and particular account of the execution of Thomas Black ... the 10th December, 1823, for housebreaking and theft - L.C.Fol.74(335)"
74460228.txt,"Full and particular account of the execution of Thomas Black ... the 10th December, 1823, for housebreaking and theft - Ry.III.a.2(049)"
74460229.txt,"Full and particular account of the execution of Thomas Conner and Bell M'Menemy, who were executed at Glasgow ... 22d October 1828, for assault and robbery - Ry.III.a.2(087)"
74460230.txt,"Account of the execution of William Buchanan and William M'Leod and Thomas Donaldson, at Aberdeen on ... 23d May 1823, with the affecting seperation [sic] with their parents and relations, also a ... speech made by Buchanan on the scaffold - Ry.III.a.2(038)"
74460237.txt,"Account of the execution of Hans Regelson, a Danish seaman, who was executed in front of the Council-Room, Perth, on Friday the 28th of June, 1811 ... for committing a rape on Margaret Budge - 6.314(24)"
74460238.txt,"Correct and particular account of the execution of Charles M'Ewen, commonly called ""The Cock of the North"", who was hanged ... 7th April 1824, at the head of Libberton Wynd, Edinburgh, for the barbarous murder of Margaret Mooney, in October last, on a moo - F.3.a.14(28)"
74460240.txt,"Execution of Doolan and Redding - APS.4.200.05"
74460246.txt,"Particular account of the behaviour and execution of William Leonard Swan, at Glasgow, on Wednesday the 16th May, 1821, for uttering two forged five pound notes of the Paisley Banking Company, in the month of November last - L.C.Fol.73(21)"
74460247.txt,"Full ... account of the execution of George Gilchrist, at the head of Libberton's Wynd, on ... third of August, 1831, for the robbery of the Prince Regent, Edinburgh coach ... together with an account of the confession of the ... criminal - Ry.III.a.2(111)"
74460248.txt,"Full and particular account of John Dempsey, late private soldier ... who was executed at Edinburgh on ... the 13th December, 1820, for murder, committed at Greenock ... including his behaviour at the place of execution - Ry.III.a.2(14)"
74460249.txt,"Full and particular account of the execution of John Rennie, and William Sutherland, who were executed at Edinburgh on ... the 22d August, 1821, for housebreaking and theft, with their behaviour at the place of execution - Ry.III.9.2(72)"
74460250.txt,"Full and particular account of the execution of John Wilson and Duncan Fraser, who were executed at the head of Libberton Wynd, Edinburgh ... 28th January, 1824, for housebreaking and theft; with a particular account of their behaviour since their condemn - Ry.III.a.2(052)"
74460252.txt,"Full and particular account of the execution of William Adams ... who was this day ... 6th January 1830, executed at the head of Libberton Wynd, Lawnmarket, for assaulting and robbing Michael Pirnie ... with his last dying speech on the scaffold - Ry.III.a.2(091)"
74460253.txt,"Executions In Paisley - APS.3.98.9"
74460308.txt,"Horrid Murder committed by Margaret Henderson - F.3.a.14(13)"
74460359.txt,"Full, True and Particular Account of the Lives and Transactions of David Dobie and John Thomson, the Gilmerton Murderers, together with a very full and most correct account of their conduct and declarations in the Lock-up-house, on the night before the ex - F.3.a.14(68)"
74460365.txt,"Mansie Waugh's dream concerning the execution of Burke - Ry.III.a.6(25)"
74460383.txt,"Full and Particular Account of the Life, Transactions, Confessions, and Behaviour of Margaret Davidson, who was Executed at Aberdeen, on Friday the 8th October 1830, for the most atrocious and inhuman Murder of her Husband, by pouring Poison down his thro - F.3.a.13(55)"
74460407.txt,"Penitence of James Gow - F.3.a.13(15)"
74460418.txt,"Respite of James Wemyss - L.C.Fol.74(359b)"
74460438.txt,"Account of the behaviour and execution of James Glen, who was executed at Glasgow on Wednesday the 12th of December, 1827, for the inhuman murder of his own son, by drowning him in the canal, near Port-Dundas - L.C.Fol.73(110v)"
74460442.txt,"Full ... account of the execution of James Gow ... and Thomas Beveridge ... for the ... murder of their wives - F.3.a.13(69)"
74460465.txt,"Sutherland's lament, for the loss of his post, with his advice to John Dagless his successor - Ry.III.a.10(96)"
74460496.txt,"Sketch of the Conduct, Transactions and Behaviour of DAVID DOBBIE and JOHN THOMSON, who were Executed on Wednesday the 18th August, for Assault, Murder and Robbery, with their Last Dying Confession, and Behaviour on the Scaffold - F.3.a.14(69)"
74460499.txt,"Highland man's lament, for the death of Donald Bayn, alias M'Evan Vanifranck, who was execute in the Grass Market of Edinburgh, on Wednesday the 9th day of January 1723 - L.C.Fol.76(118)"
74460534.txt,"Life of Calcraft - L.C.Fol.73(132)"
74460542.txt,"Only true account - F.3.a.13(54)"
74460590.txt,"Trial and execution of James Wilson, at Carlisle ... 16th March [1835], for the wilful murder of John Elliot, a poor pack boy, on Eastdale Moor - Ry.III.a.2(114)"
74460685.txt,"Following is a correct account of all the Public executions which have taken place in Glasgow, for the last fifty-six years, with the year and the day of the month on which they suffered, which is a very affecting calendar, and worthy of preservation - L.C.Fol.73(15)"
74460788.txt,"Account of the execution of Andrew Fullarton, who suffered at Edinburgh, on Wednesday the 16th August, 1826, for highway robbery, between Edinburgh and Dalkeith, on the 18th April last - Ry.III.a.2(072)"
74460794.txt,"Account of the last days, behaviour and execution of James Bryce, labourer, who was executed here this morning, 3d April, 1844, for the murder of his brother-in-law, John Geddes, at Blaw Wearie, parish of West Calder, on 27th December last - L.C.Fol.74(339)"
74460797.txt,"Particular account of the execution of John Craig and James Brown, who were executed at Paisley, on ... 29th of October, 1829 for the crime of stouthrief - Ry.III.a.2(90)"
74460799.txt,"Full and particular account of the execution of John M'Graddy - Ry.III.a.2(68)"
74460804.txt,"Full and true account of the behaviour and execution of Margaret Wishart, who was executed at Forfar, on Saturday last the 16th June, 1827, for the horrid and cruel murder of her own blind sister - APS.4.95.12"
74460805.txt,"Particular account of the execution of these three unfortunate young men, Michael Macintyre, Wm. Paterson and Wardrope Dyer, who were executed at Glasgow, yesterday, the 24th October, with their dying behaviour - L.C.Fol.74(76)"
74460809.txt,"Full and particular account of the execution of Robert Tennant,  who was executed at Stirling on Wednesday morning, the 2d of October, for the bloody murder of William Peddie, an old man, about 70 years of age, on high road between Beancross and Kerse tol - Ry.III.a.2(113)"
74460810.txt,"Account of the execution of William Dornan, and Robert Smyth, who were hanged at Air [sic], on Friday the 26th day of May, pursuant to their sentence, for housebreaking and theft - 6.314(22)"
74460811.txt,"Execution of that unfortunate young man, William McIntyre, belonging to Glasgow, who was executed at Edinburgh on Wednesday morning the 26th Feb. 1823, for housebreaking and theft - L.C.Fol.73(045)"
74460873.txt,"Gentleman's letter to the Laird of Boghall, the day before his execution, with Boghall's answer - Ry.III.c.36(53)"
74462662.txt,"Genuine and latest account of the excution [sic] of John Campbell who suffered at Stirling - Ry.III.a.2(57)"
74458992.txt,"Hundred years to come - L.C.Fol.70(204)"
74459033.txt,"Adieu, my native land, adieu - L.C.1269(177b)"
74459091.txt,"Bonnie Jeanie Shaw - L.C.Fol.70(047)"
74459104.txt,"Bonny Nelly Brown - L.C.fol.178A.2(081)"
74459116.txt,"Bundle and go - L.C.Fol.70(38a)L.C.Fol.70(075)"
74459124.txt,"Call me back again - L.C.Fol.70(179)"
74459134.txt,"Cheer, boys, cheer - APS.4.86.2"
74459164.txt,"Donald's farewell to Lochaber - L.C.fol.178A.2(122)"
74459181.txt,"Fareweel - L.C.Fol.70(229)"
74459207.txt,"Good by my darling - L.C.Fol.70(200)"
74459276.txt,"John Reilly - L.C.fol.178A.2(072)"
74459310.txt,"Lovely Mourin shore - L.C.Fol.178A.2(066)"
74459350.txt,"My boughel roe - L.C.Fol.178A.2(061)"
74459358.txt,"My own mountain home - L.C.fol.178A.2(082)"
74459393.txt,"Patriotic song - RB.m.143(195)"
74459424.txt,"Sally Munro - RB.m.169(128)"
74459469.txt,"Anchor's weighed - L.C.Fol.70(181)"
74459473.txt,"Auld house - L.C.Fol.70(042)"
74459529.txt,"Country I'm leaving behind - L.C.Fol.70(044)"
74459530.txt,"Country I'm leaving behind - L.C.Fol.70(149)"
74459554.txt,"English emigrant - RB.m.143(137)"
74459561.txt,"Five shilling fee - RB.m.143(025)"
74459573.txt,"Gipsey laddie - L.C.fol.178A.2(092)"
74459653.txt,"Poet's return - APS.3.87.112"
74459676.txt,"Scottish emigrant's fareweel - L.C.Fol.178A.2(080)"
74459689.txt,"Song of the emigrant - L.C.Fol.70(058)"
74459730.txt,"Thy voice is near - L.C.1269(295)"
74459738.txt,"Toon of Arbroath - L.C.Fol.70(6b)/L.C.Fol.70(012)"
74459742.txt,"Traveller's return - L.C.fol.178A.2(215)"
74459788.txt,"Young emigrant's farewell - L.C.fol.178A.2(017)"
74459834.txt,"Edinburgh convicts - APS.4.86.33"
74459836.txt,"Girl I left behind me / Brennan on the moor - L.C.1270"
74459853.txt,"Wait till the clouds roll by - RB.m.143(032)"
74460018.txt,"Very curious letter from a cotton spinner in Canada - L.C.Fol.73(94)"
74460187.txt,"Emigration to the Cape of Good Hope - APS.4.81.45"
74460299.txt,"Horrible confession - L.C.Fol.74(78)"
74561264.txt,"New Song - Ry.III.a.10(46)"
74459059.txt,"Banks o' Tyne - L.C.Fol.70(213)"
74459070.txt,"Belle Brandon, the beauty of the valley - L.C.1269(154a)"
74459121.txt,"Burns, old Scotland's son of song - L.C.Fol.70(8a)"
74459155.txt,"Death & the lady - L.C.Fol.70(52)/L.C.Fol.70(100)"
74459175.txt,"Elegy on the death of the late executioner - L.C.Fol.73(1)"
74459193.txt,"Forty years ago - L.C.1269(314)"
74459203.txt,"Gentle Annie - L.C.Fol.178A.2(60)"
74459210.txt,"Gray's ellegie [sic] with his own conceity [sic] answer - Ry.III.c.36(112)"
74459247.txt,"It is but a little golden ring - L.C.Fol.70(191)"
74459295.txt,"Life and death of the piper of Kilbarchan, or, The epitaph of Habbie Simpson - RB.l.262(021)"
74459302.txt,"Little Nell - L.C.fol.178A.2(020)"
74459309.txt,"Lottie Lane - L.C.1269(269)"
74459317.txt,"Lurgan braes - L.C.fol.178A.2(057)"
74459357.txt,"My Nannie's awa - L.C.Fol.70(14a)/ L.C.Fol.70(027)"
74459401.txt,"Poor Mary of the wild moor - L.C.fol.178A.2(072)"
74459402.txt,"Poor Nancy Graham - L.C.Fol.70(253)"
74459403.txt,"Poor old Jeff - L.C.1269(294)"
74459432.txt,"Scotia's dirge - RB.m.143(200)"
74459459.txt,"Take your ald cloak about you - RB.l.262(052)"
74459531.txt,"Cradles empty babys gone - L.C.Fol.70(116)"
74459579.txt,"Grave O' Rabbie Burns - L.C.Fol.70(32)"
74459616.txt,"Light of other days - L.C.1269(287)"
74459683.txt,"Shepherds tears - Ry.III.c.36(99)"
74459707.txt,"True way of the bonny bruiked lassie - RB.l.262(054)"
74459716.txt,"Wee lassie sitting at the door - L.C.fol.178A.2(084)"
74459732.txt,"Tis but a little faded flower - L.C.Fol.70(126)"
74459733.txt,"Tis but a little faded flower - RB.m.143(152)"
74459753.txt,"We are brethren a' - RB.m.143(153)"
74459755.txt,"We've aye been provided for - RB.m.143(154)"
74459954.txt,"Sorrowfull lamentation of Nicol Muschet of Boghall, who was execute in the Grass-Market of Edinburgh, on the 6th. of January, 1721  for murdering of his wife - Ry.III.c.36(54)"
74459958.txt,"On the death of the Right Honourable James Earle of Perth, Lord Drummond and Stobhall - L.C.Fol.76(134?)"
74459959.txt,"Gillmertoun Vulcan gone, who hew'd seven fire-rooms in a single stone: or, an elegy on George Paterson smith, good-man of the famous Gillmertoun caves - Ry.III.c.36(115)"
74459976.txt,"Discription [sic] of a kirk treasurer, or, An elegie on John Couper - RB.l.106(99)"
74460043.txt,"Elegie upon the never enough to be lamented death, of the Right Honourable Adam Brown, Esq; Lord Provost of Edinburgh, who departed this life the 16 of October; 1711 - RB.l.262(085)"
74460044.txt,"Elegie, upon the much to be lamented death of Colonel Sara, who departed this life, at Leith, the 28th. of August 1718 - Ry.III.c.36(108)"
74460045.txt,"Elegie, on, the never enough to be lamented death, of the Reverend Mr. William Delape preacher of the Gospel, who departed this life October 30, 1720 - Ry.III.c.36(67)"
74460046.txt,"Elegy upon the exceeding much to be lamented death of the illustrious Princess Anne Dutches [sic] of Hamilton, who departed this life the 16th of October 1716, in the 96th. year of her age - Ry.III.c.36(26)"
74460047.txt,"Elegy on the moeh [sic] to be lamented death of Commissioner Kello, who departed this life the 2d. of October 1716 - Ry.III.c.36(27)"
74460048.txt,"Elegy on the Reverend Doctor John Gillies, one of the ministers of Glasgow who died in the 84th year of his own age, and the 54th year of his ministry - 6.365(107)"
74460049.txt,"Elegy on the much to be lamented death, of Francis Masterton apothecary - Ry.III.c.36(110)"
74460050.txt,"Elegy upon the much lamented death of Janet Hill, spouse to the famous Tinclarian Doctor William Mitchell, who departed this life, 13th of October 1716 - Ry.III.c.36(90)"
74460051.txt,"Elegy on the much to be lamented death of Mr. John Merry surgeon apothecary - Ry.III.c.36(109)"
74460052.txt,"Elegy on the much to be lamented death, of the Reverend, Mr. Joseph Foord, Minister of the Gospel at Edinburgh, who departed this life July the 15th, 1719 - Ry.III.c.36(10)"
74460054.txt,"Elegy on Lucky Gibson, who departed this life January 20th, 1718 - Ry.III.c.36(37)"
74460055.txt,"Elegy on the never to be lamented death of Mirs. M'Leod, who was execute on Wednesday the 8th of March, 1727 - Ry.III.a.10(110)"
74460056.txt,"Elegy on the death of the much lamented Reverend Mr. William Dunn, late Minister of Kirkintilloch, who died on Saturday, November 3, 1798 - 6.365(108)"
74460057.txt,"Elegy upon the much to be lamented death of the Reverend Mr. John Wilson, Minister of the Gospel at North Lieth, who departed this life the 1st. of September, 1724 - Ry.III.c.36(98)"
74460058.txt,"Elegy to the lasting memory, and upon the much to be lamented death of the pious, and well accomplished gentleman, and much honoured, William Nisbet of Dirletoun - Ry.III.c.36(100)"
74460059.txt,"Elogie [sic] on the much lamented death of Mr. John Hamilton, Minister of the Gospel in the Gray-Friars Parish of Edinburgh; and sometime, formerlie in Ireland - Ry.III.c.36(105)"
74460064.txt,"Habbiack elegy on the untimely and deplorable death of Robert F-----s Kirk Treasurer's man, who dy'd November 3d. 1724 - Ry.III.c.36(95)"
74460158.txt,"Elegie on the much to be lamented death of the Right Honourable, Alexander Lord Reath, one of his Majesties most honourable Privy Council, and Exchequer, &c. departed this life, March 21 1698 - Ry.III.c.35(5)"
74460159.txt,"On the death of His Grace John Duke of Rothes, Lord High Chancellour of Scotland, &c. - Ry.III.c.36(1)"
74460160.txt,"On the never enough lamented death, of the Right Honourable John Murray Lord Bowhill, one of the senators of the colledge of justice; who departed this life upon the 26th March 1714 - L.C.Fol.76(88)"
74460161.txt,"Elegie on John Pringle, town-piper of Lauder - Ry.III.c.36(114)"
74460162.txt,"To the memory of the Right Honourable Margaret Countess of Weems who departed this life at Weems, February 20 1688 - Ry.III.c.36(2)"
74460163.txt,"Elegie on the much to be lamented death, & loss of the Right Honourable; William Earl of Crawfoord - Ry.III.c.36(3)"
74460164.txt,"Elegie on the never enough to be lamented cruel death, of the most hopeful and gallant young gentleman, Mr William Rue, of Chesters - Ry.III.c.36(12)"
74460165.txt,"Elegy on the much to be lamented death, of Lord Alexander Ross, Bishop of Edinburgh, who departed this life March the 20th, 1720 - Ry.III.c.36(64)"
74460166.txt,"Elegy on the much to be lamented death of David Earl of Weems, who departed this life March the 13th, 1720 - Ry.III.c.36(63)"
74460167.txt,"Mushcet revived; or an elegy on the deplorable death of Elizabeth Murray sister to Sir William Murray of Newtoun barb'rously murdered by her husband Thomas Kincaid younger of Gogar-Mains, March 29th 1723 - RB.l.106(85)"
74460168.txt,"Elegy, on the never enough to be lamented death of that vertuous and worthy gentleman Capt: Geo: Drummond, who dyed at Edinburgh, September 26, 1720 - Ry.III.c.36(68)"
74460169.txt,"Elegy, on the much to be lamented death of James Whetty taylor and free-man in th Pattaraw who departed this life Apprile [sic] the 5th, 1720 about the 69. of his age - Ry.III.c.36(111)"
74460170.txt,"Elegy on the deplorable death of the Right Honourable John, Lord Belhaven, who was lost at sea, on the 10th of Nov. 1721 - Ry.III.c.36(9)"
74460171.txt,"Elegy on the much lamented death, of loyal Margaret, who departed this life June the 6th 1717 - Ry.III.c.36(36)"
74460172.txt,"Elegy on Lucky Wood - Ry.III.a.10(112)"
74460173.txt,"Elegy on the much lamented death of merry Maggie Wilson, poultry-wife in Edinburgh - RB.l.106(89)"
74460174.txt,"Elegy on the deplorable death of Margaret Hall, barbarously murder'd by her husband Nicol Mushet of Boghall, Mondays night the 17 October 1720, in the 17th year of her age - Ry.III.c.36(56)"
74460175.txt,"Elegy on the death of Nicol Muschet of Boghall written, at the desire of his friends - Ry.III.c.36(55)"
74460176.txt,"Elegy on the death of Patrick Hamilton younger of Green, who was beheaded at the Grass-merkat of Edinburgh, upon the 5th of September 1716 - Ry.III.c.36(34d)"
74460178.txt,"Elegy, upon the much to be lamented death of Sir Robert Blacwood, late Provost in Edinburgh - Ry.III.c.36(65)"
74460181.txt,"Elegy on the late Wee Geordie More - L.C.1268(084)"
74460183.txt,"Elegy and epitaph on Thomas Williams, late dempster, or hangman, of the City of Edinburgh - F.3.a.13(76)"
74460185.txt,"Elegy on Thomas Smellie third son of the late Mr. William Smellie, F.R.S. & A.S.S. - L.C.Fol.74(327)"
74460186.txt,"Elegy, on the death of Hary Ormiston, late hangman of Edinburgh - Ry.III.c.36(120)"
74460275.txt,"Gardner Tammy - L.C.fol.178A.2(232)"
74460393.txt,"Elegy on the lamented death of Alexander Cairns, who was barbarously murder'd on Thursday last - RB.l.106(87)"
74460479.txt,"Coblers' tears - L.C.1268(026)"
74460488.txt,"Faithful sheepherd - Ry.III.c.36(34a)"
74460529.txt,"Last dying words of Bonny Heck, a famous grey-hound in the shire of Fife - RB.l.262(047)"
74460680.txt,"Auld Reekie's lament for John Kennedy - L.C.1268(132)"
74460696.txt,"Verses on Burns' centenary - RB.m.143(202)"
74460726.txt,"Ship sinking - RB.m.143(45)"
74536272.txt,"Elegy on Willy Bald who was long porter in Traquaire - Ry.III.a.10(39)"
74555648.txt,"Lady Ann's new mill - Ry.III.a.10(64)"
74558268.txt,"Life and death of the Piper of Kilbarchan - Ry.III.a.10(17)"
74581400.txt,"Robert Muirheads lament - Ry.III.a.10(66)"
74581974.txt,"Royal shepherd's happy life - Ry.III.a.10(48)"
74457832.txt,"Trial of Mr. James Stuart ... for being art and part in a duel in which Sir Alexander Boswell lost his life - L.C.Fol.74(73)"
74460006.txt,"Poem on the much to be lamented death of Captain Chiesly and Lieutenant Moody - Ry.III.c.36(148)"
74460016.txt,"True account of that fatal duel between James Stuart and Sir Alexander Boswell - Ry.III.a.2(025)"
74460143.txt,"Dreadful duel - L.C.Fol.74(193)"
74460152.txt,"Duel extraordinary - L.C.1268(064)"
74460262.txt,"Fatal duel - L.C.Fol.74(96)"
74460263.txt,"Fatal duel - L.C.Fol.74(99)"
74460530.txt,"Late duel - L.C.Fol.73(032)"
74460560.txt,"Whole particulars of the trial of Mr James Stuart, before the High Court of Justiciary on Monday the 10th June 1822, for being concerned in the fatal duel on the 26th March last, when Sir Alexander Boswell was mortally wounded, and died the following day - Ry.III.a.2(027)"
74460658.txt,"Unfortunate duel - L.C.Fol.73(33)"
